; Austria; Belgium; CzechRepublic; Denmark; Estonia; Finland; France; Germany; Greece; Hungary; Iceland; Ireland; Italy; Luxembourg; Netherlands; Norway; Poland; Portugal; Romania; Russia&Belarus; Slovakia; Slovenia; Spain; Sweden; Switzerland&Liechtenstein; Turkey; Ukraine; UnitedKingdom
End of overtaking prohibition; ; ; ; ; ; ; ; ; ; ; ; ; ; ; ; ; ; ; ; ; ; ; ; ; ; ; ; 
End of no honking;NOTUSED;NOTUSED; ;NOTUSED;NOTUSED;NOTUSED; ;NOTUSED;NOTUSED;NOTUSED;NOTUSED;NOTUSED;NOTUSED;NOTUSED;NOTUSED;NOTUSED; ; ;NOTUSED;NOTUSED; ; ; ;NOTUSED;DISUSED;NOTUSED;NOTUSED;NOTUSED
End of maximum speed limit; ; ; ; ; ; ; ; ; ; ; ; ; ; ; ; ; ; ; ; ; ; ; ; ; ; ; ; 
End of all restrictions; ; ; ; ; ;NOT  USED; ; ; ; ; ; ; ; ; ;; ; ; ; ; ; ; ;NOTUSED; ; ; ;NOTUSED
End of speed limit zone; ; ; ; ; ; ; ; ; ; ; ; ; ; ;; ; ; ; ; ; ; ; ; ;or; ; ; 
