Engine;Status;Embedded in
Blink;Active;Google Chrome and Chromium, plus many other browsers including Opera and Vivaldi
EdgeHTML;Active;Microsoft Edge browser and Universal Windows Platform apps
Gecko;Active;Firefox browser and Thunderbird email client, plus forks like SeaMonkey and Waterfox
WebKit;Active;Safari browser, Adobe AIR apps, and other browsers like Maxthon
KHTML;Discontinued;Konqueror browser
Presto;Discontinued;formerly in the Opera browser
Trident;Discontinued;Internet Explorer browser and Microsoft Outlook email client
